,title,content,site,publish_date
23,Pedro Castillo: “El Ministerio de Cultura ahora será Ministerio de las Culturas”,"PolíticaPedro Castillo: “El Ministerio de Cultura ahora será Ministerio de las Culturas”Política LRPolitica_LRediciondigital@glr.pe28 Jul 2021 | 16:05 hActualizado el 28 de Julio 2021 | 16:05 hPedro Castillo anunció cambios en el Ministerio de Cultura. Foto: Captura La RepúblicaDurante su mensaje a la nación, el mandatario anunció que se buscará interculturalizar el Estado con un ministerio que “reconozca las diversas culturas”. PublicidadEl presidente de la República, Pedro Castillo, manifestó durante su mensaje a la nación que se harán cambios en el Ministerio de Cultura para “tomar en cuenta las voces de los pueblos” y que deberá ser renombrado a “Ministerio de las Culturas”.“La gestión de las culturas será descentralizada, una de las cuentas pendientes es el reconocimiento de la diversidad cultural en la formulación de políticas públicas, lo que ha significado que peruanos y peruanas sean invisibilizados como lo eran hace 200 años”, expresó.“Resulta necesario interculturalizar al Estado; es decir, establecer que cuando se toman decisiones relevantes, se tome en cuenta las voces de los pueblos y las comunidades originarias y del pueblo afroperuano. En este sentido, se requiere una reestructuración del Ministerio de Cultura, empezando por el nombre, que atendiendo a la realidad deberá ser renombrado como el ‘Ministerio de las Culturas’”, anunció.Castillo justificó el cambio de nombre del Ministerio de Cultura en la necesidad de tomar en cuenta la opinión de los pueblos originarios para la creación de políticas públicas. “En un país diverso como el nuestro, se necesita un ministerio que reconozca las diversas culturas, lenguas vigentes y ejecute políticas donde los propios pueblos originarios participen en su elaboración y ejecución”, puntualizó.Finalmente, Castillo anunció que la sede del Ministerio de las Culturas será el propio Palacio de Gobierno. “Debo decirles que yo no gobernaré dese la ‘Casa de Pizarro’. Creo que tenemos que romper con los símbolos coloniales para romper con las ataduras de la dominación que se han mantenido vigentes. Cederemos este palacio al nuevo Ministerio de las Culturas para que sea usado como un museo que muestre nuestra historia desde sus orígenes hasta la actualidad”, sentenció.Política, últimas noticiasSagasti fue impedido de ingresar al Congreso y entregó la banda presidencial en la puertaMensaje a la nación de Pedro Castillo: revive el discurso presidencial de este 28 de julioPedro Castillo afirmó que el 2026 dejará el GobiernoMensaje a la nación de Pedro Castillo EN VIVO HOY 28 de julio: minuto a minutoNewsletter Política LRSuscríbete aquí al boletín Política La República y recibe a diario en tu correo electrónico las noticias más destacadas de los temas que marcan la agenda nacional.Recibe las noticias de La República en Google NewstemasPedro Castillo TerronesMinisterio de Cultura",larepublica,2021-07-28 21:05:53.435000+00:00
24,Ministros agradecen a Francisco Sagasti antes de dejar sus cargos,"PolíticaMinistros agradecen a Francisco Sagasti antes de dejar sus cargosPolítica LRPolitica_LRediciondigital@glr.pe28 Jul 2021 | 16:02 hActualizado el 28 de Julio 2021 | 16:02 hFrancisco Sagasti recibió agradecimiento de sus ministros. Foto: Composición LR / EFE/capturas TwitterWaldo Mendoza, Nuria Esparch, Ricardo Cuenca, entre otros, le agradecieron al expresidente Sagasti por la oportunidad de servir al país. PublicidadLos ministros que acompañaron al expresidente Francisco Sagasti durante su gestión en el Gobierno de Transición y Emergencia, le expresaron su agradecimiento a través de sendos mensajes en las redes sociales.A primer turno, la titular de la Presidencia del Consejo de Ministros (PCM), Violeta Bermúdez, agradeció a Sagasti por haberle dado la oportunidad de servir al Perú.Imagen: Twitter / Violeta BermúdezEn la misma tónica, Sagasti recibió los saludos y agradecimientos de Nuria Esparch, ministra de Defensa, Ricardo Cuenca encargado de la cartera de Educación y Waldo Mendoza, titular de Economía.“Gracias, presidente Sagasti y Violeta Bermudez por darme el honor de haber servido a mi país y ser la primera mujer ministra de Defensa”, publicó Esparch en su cuenta de Twitter. En tanto, Cuenca expresó: “quiero agradecer al presidente Sagasti por darme la oportunidad de servir al país en aquello que, sostengo, es lo más importante: la educación”.El mensaje de agradecimiento de Nuria Esparch. Foto: Captura Twitter.El mensaje de agradecimiento de Ricardo Cuenca. Foto: Captura Twitter.El mensaje de agradecimiento de Waldo Mendoza. Foto: Captura Twitter.De la misma forma, los ministros Gabriel Quijandría (Ministro del Ambiente), Solangel Fernández (Ministra de Vivienda), Eduardo González (Ministro de Transportes y Comunicaciones), Claudia Cornejo (Ministra de Comercio Exterior y Turismo), José Luis Chicoma (Ministro de la Producción) y Federico Tenorio (Ministro de Agricultura), manifestaron sus sentimientos de agradecimiento hacia Francisco Sagasti. Todo esto previo a entregar sus carteras a los nuevos titulares de los diversos sectores, los mismos que serán nombrados en los próximos días por el presidente Pedro Castillo.Mensaje de agradecimiento de José Luis Chicoma a Francisco Sagasti. Foto: Captura TwitterMensaje de agradecimiento de Solangel Fernández a Francisco Sagasti. Foto: Captura TwitterMensaje de agradecimiento de Claudia Cornejo a Francisco Sagasti. Foto: Captura TwitterMensaje de agradecimiento de Gabriel Quijandría. Foto: Captura TwitterMensaje de agradecimiento de Federico Tenorio a Francisco Sagasti. Foto: Captura TwitterMensaje de agradecimiento de Eduardo González a Francisco Sagasti. Foto: Captura TwitterPolítica, últimas noticiasMensaje a la nación de Pedro Castillo EN VIVO HOY 28 de julio: minuto a minutoSilva Santisteban sobre entrega de banda presidencial: “Se trata de un maltrato a Sagasti”Sagasti fue impedido de ingresar al Congreso y entregó la banda presidencial en la puertaNewsletter Política LRSuscríbete aquí al boletín Política La República y recibe a diario en tu correo electrónico las noticias más destacadas de los temas que marcan la agenda nacional.Recibe las noticias de La República en Google NewstemasFrancisco SagastiVioleta BermúdezPCMWaldo Mendoza",larepublica,2021-07-28 21:02:37.829000+00:00
25,María del Carmen Alva: “No ha habido ningún desaire a Sagasti”,"PolíticaMaría del Carmen Alva: “No ha habido ningún desaire a Sagasti”Política LRPolitica_LRediciondigital@glr.pe28 Jul 2021 | 16:02 hActualizado el 28 de Julio 2021 | 16:02 hMaría del Carmen Alva negó haber desairado a Francisco Sagasti. Foto: Composición GLRLa actual presidenta de la Mesa Directiva del Congreso manifestó que la negativa al ingreso de Francisco Sagasti para entregar la banda presidencial “se debió a un tema de protocolo”. PublicidadLa presidenta de la Mesa Directiva del Congreso, María del Carmen Alva intentó explicar el hecho de no haber dejado ingresar al expresidente Francisco Sagasti al Congreso para la entrega de la banda presidencial.Alva aseguró que todo se debió a un tema de protocolo y que no hubo ningún tipo de desaire hacia Sagasti. “Hay un protocolo y los de protocolo son los que han visto el tema, eso es lo que correspondía. El presidente era encargado siempre y cuando fuera presidente del Congreso. Desde el 26 julio ya no lo es, así que lo que correspondía era dejar la banda”, señaló la congresista de Acción Popular.“Acá no hay ningún desaire. Se está elaborando un comunicado que informará que ese era el procedimiento, yo no tuve nada que ver con el protocolo. Él debió mandar la banda ayer pero quiso llevarlo él, eso es todo lo que ha pasa”, agregó.No obstante, este hecho ha provocado la crítica de diversas personalidades de la política nacional. La congresista Flor Pablo aseguró que expresarán su desacuerdo de manera formal a la presidencia de la Mesa Directiva del Congreso.“Esa es una decisión de la Mesa Directiva, no estábamos enterados. Nos parece muy mal que se haya hecho así, creo que hay que respetar las formas, la investidura del presidente saliente, que ha hecho un gran trabajo al darle al país elecciones democráticas y la vacunación, dos promesas cumplidas y creo que lo mínimo que merecía era poder entrar al Congreso y no ser recibido así. Fue decisión de la presidenta de la Mesa Directiva del Congreso y nosotros vamos a mandar una comunicación formal señalando nuestro desacuerdo”, puntualizó.Entre los que criticaron el desplante se encuentran el expresidente Ollanta Humala, el excandidato presidencial Julio Guzmán, el excongresista Mesías Guevara, la congresista Susel Paredes, entre otros.Política, últimas nocitiasSagasti fue impedido de ingresar al Congreso y entregó la banda presidencial en la puertaMensaje a la nación de Pedro Castillo: revive el discurso presidencial de este 28 de julioPedro Castillo afirmó que el 2026 dejará el GobiernoNewsletter Política LRSuscríbete aquí al boletín Política La República y recibe a diario en tu correo electrónico las noticias más destacadas de los temas que marcan la agenda nacional.Recibe las noticias de La República en Google NewstemasFrancisco SagastiCongreso del Perú",larepublica,2021-07-28 21:02:10.343000+00:00
26,Mensaje a la nación por el Bicentenario del Perú de Pedro Castillo HOY juramentación del nuevo presidente del Perú: toma de mando Perú a qué hora será el mensaje a la nación a qué hora juramenta el nuevo presidente juramentación en vivo juramentación de Pedro Castillo hoy vía ATV noticias TV Perú América TV,"PolíticaPedro Castillo: revive el mensaje a la nación y juramentación del Presidente del Perú en el bicentenarioPolítica LRPolitica_LRediciondigital@glr.pe28 Jul 2021 | 15:55 hActualizado el 28 de Julio 2021 | 15:55 hPedro Castillo fue elegido por el electorado como presidente constitucional para el periodo 2021-2026. Foto: Composición Gerson Cardoso/La RepúblicaEncuentra todos los detalles del mensaje a la nación de Pedro Castillo Terrones como el nuevo Presidente del Perú durante la asunción presidencial. PublicidadEste miércoles 28 de julio, día en que se conmemora el Bicentenario de la Independencia del Perú, el presidente de la República, Pedro Castillo, dará su primer mensaje como jefe de Estado luego de asumir dicho cargo en la Sesión Solemne que se celebrará en el Congreso.El maestro de escuela chotano fue proclamado como mandatario electo el 19 de julio por el Jurado Nacional de Elecciones (JNE), entidad que desestimó por mayoría los recursos legales presentados por Fuerza Popular, que retrasaron la oficialización de la victoria de Castillo Terrones en las urnas.¿A qué hora será el mensaje a la nación de Pedro Castillo?De acuerdo con el comunicado de prensa, la Mesa Directiva del Parlamento convocó a Sesión Solemne este miércoles 28 de julio a las 9.00 a. m. En dicha ceremonia se llevará a cabo la transferencia de mando supremo al candidato ganador de la segunda vuelta de las Elecciones Generales 2021, José Pedro Castillo Terrones, quien postuló con la organización política Perú Libre.Luego de jurar al puesto, se espera que el maestro de escuela dé su primer mensaje al Pleno del Congreso, que será transmitido a nivel nacional por los distintos canales de televisión y radioemisoras.¿Dónde ver el mensaje presidencial de Pedro Castillo?Los actos oficiales del Estado son transmitidos por TV Perú, cuya señal puedes encontrar en los siguientes canales:SatéliteDirecTV: Canal 197 (SD) y 1197 (HD)Movistar TV: Canal 107Claro TV: Canal 1007 (HD).CableMovistar TV: Canal 7 (SD) y 707 (HD)Claro TV: Canal 7 (SD) y 507 (HD).De igual manera, otras casas televisivas nacionales de señal abierta y cerrada, como Latina, América TV, Panamericana, N, ATV y RPP, suelen emitir la ceremonia del 28 de julio.¿Quiénes estarán como invitados en la toma de mando de Pedro Castillo?Hasta la fecha, los siguientes mandatarios, funcionarios y figuras públicas internacionales confirmaron su presencia en la juramentación presidencial de Pedro Castillo:Felipe VI, rey de EspañaAlberto Fernández, presidente de ArgentinaLuis Arce Catacora, presidente de BoliviaIván Duque, presidente de ColombiaGuillermo Lasso, presidente de EcuadorSebastián Piñera, presidente de ChileFrancisco Bustillo, canciller de UruguayHamilton Mourao, vicepresidente de BrasilMiguel Cardona, secretario de Educación de Estados UnidosEvo Morales, exmandatario de Bolivia.¿Qué temas se tocarían en el mensaje presidencial de Pedro Castillo?En su primer mensaje presidencial, Pedro Castillo abordaría temas de interés nacional, tales como el proceso de vacunación contra la COVID-19, las medidas para contener el avance de la pandemia y la política económica durante su primer año de Gobierno.De igual manera, no se descarta que el nuevo gobernante traiga a la mesa la convocatoria a una Asamblea Constituyente, una de sus principales promesas de campaña, a fin de reemplazar la carta magna que se impuso luego del autogolpe perpetrado por el exdictador Alberto Fujimori.¿Cuál es el plan de Gobierno de Pedro Castillo?Al momento de la inscripción de la plancha presidencial del partido del lápiz, el plan de Gobierno se llamaba Ideario y Programa de Perú Libre, que fue redactado por el suspendido gobernador de Junín y secretario general de dicha organización, Vladimir Cerrón.No obstante, luego de acceder al balotaje, Pedro Castillo, junto a su equipo técnico, redactó un nuevo documento titulado Perú al Bicentenario sin corrupción, 17 páginas que resumen las medidas a tomarse en los primeros 100 días de gestión.En relación a la emergencia sanitaria a causa del nuevo coronavirus, este nuevo plan propone un Programa nacional Perú Libre de pandemia, de donde se desprenden las siguientes iniciativas:Distribución gratuita del oxígeno medicinalImplementación de camas UCIVacunación universal y gratuita, sin corrupción ni privilegios.En materia económica, el apartado Relanzamiento del empleo y la economía popular cuenta con las siguientes propuestas:Fortalecimiento de la empresa privadaAumento relevante de la Inversión públicaFomento de las compras públicas dirigidas a MYPES y similaresSubsidio temporal y focalizado por servicios (agua, electricidad e internet), como apoyo directo a la economía familiarSe frenará la competencia desleal de importaciones que afectan a la industria nacional y al campesinado, en especial a confeccionistas, industria de calzado, ganaderos lecheros y otrosEmpleo inmediato en mejoramiento de colegios, siembra y cosecha de agua, adecuación de centros de salud, caminos rurales, etc.: Programa Chamba JovenCrédito accesible para promover el AGRO y a las PYMES, a través de AGROBANCO, Banco de la Nación y Cajas Municipales con su amplia red en todo el país; además de Bancos, Cajas y Cooperativas de Ahorro y Crédito.También se pueden encontrar mecanismos para el inicio del proceso de una segunda reforma agraria, aporte justo de empresas, gas para todos, retorno seguro y oportuno a la educación presencial y convocatoria a referéndum constituyente con gran diálogo nacional y popular.Biografía y perfil de Pedro CastilloJosé Pedro Castillo Terrones nació en 1969 en el poblado de Puña, ubicado en Cajamarca. Es docente y ha liderado huelgas de educadores. En 2005 inició su incursión en la política al convertirse en miembro del Comité de Cajamarca del partido político Perú Posible.Durante su juventud, estudió en el Instituto Superior Pedagógico Octavio Mata Contreras de Cutervo. Trabaja en la institución educativa n.° 104565 del caserío de Puña en Tacabamba, Chota, desde 1995 hasta la actualidad.En el año 2017, Castillo se hizo conocido por ser el dirigente que lideró la huelga magisterial durante el Gobierno de Pedro Pablo Kuczynski. En ese entonces reclamaban el pago de la deuda social a los maestros, el incremento de los sueldos y la evaluación docente con capacitación previa.En el 2020 confirmó su participación para las elecciones presidenciales del 11 de abril de 2021 por Perú Libre, partido que tiene entre sus filas al exgobernador regional de Junín, Vladimir Cerrón.Pedro Castillo, últimas noticias:Pedro Castillo expresa su voluntad de trabajar junto con María del Carmen AlvaCerrón: “No estoy participando en el Gobierno ni voy a participar”Pedro Castillo contra el tiempo para definir gabinete de ministrosNewsletter Política LRSuscríbete aquí al boletín Política La República y recibe a diario en tu correo electrónico las noticias más destacadas de los temas que marcan la agenda nacional.Recibe las noticias de La República en Google NewstemasPedro castilloMensaje PresidencialEn vivo",larepublica,2021-07-28 20:55:09.141000+00:00
27,Toma de mando: Jorge Nieto consideró un agravio el impedimento de ingreso de Sagasti al Congreso,"PolíticaJorge Nieto consideró un agravio el impedimento de ingreso de Sagasti al CongresoPolítica LRPolitica_LRediciondigital@glr.pe28 Jul 2021 | 15:40 hActualizado el 28 de Julio 2021 | 15:40 hPara nieto, el expresidente y la ciudadanía sufrieron un agravio. Foto: Antonio Melgarejo/La RepúblicaEl exministro de defensa se refirió a lo ocurrido con el exmandatario, quien no pudo entregar la banda presidencial a Pedro Castillo.  PublicidadJorge Nieto mostró su rechazo al impase sufrido por el expresidente de la República Francisco Sagasti al ser impedido de ingresar al Congreso para entregar la banda presidencial al nuevo mandatario, Pedro Castillo.“Quisiera expresar lo que expresan en este momento miles de peruanos: un desagravio al presidente Sagasti. Yo he sido crítico de él en muchos temas y he reconocido también las virtudes que tuvo como Gobierno, pero creo que ni el ni el país se merecen un agravio como el que hemos visto todos en la pantalla”, declaró el exministro de Defensa para América Televisión.Francisco Sagasti había llegado hasta el Congreso de la República para cumplir con el acto protocolar de entregar, de manera presencial, el distintivo de jefe de Estado al ganador de las últimas elecciones presidenciales. Sin embargo, la presidenta del Parlamento, María Alva, no autorizó su entrada.En esa línea, cuando el exmandatario se disponía a dirigirse al hemiciclo, le informaron que debía dejar la banda presidencial en los exteriores del palacio legislativo. Esto devino en una clara expresión de incomodidad al hacer un gesto como si indicara que no entendía lo que acababa de suceder. Mientras tanto, el oficial mayor del Legislativo ya le había entregado otra banda a la titular de la Mesa Directiva.Alva niega que haya sido un “desaire”Por su parte, María Alva aseveró que todo se debió a una cuestión del protocolo y que no existió algún tipo de desaire hacia Sagasti. “Hay un protocolo y los de protocolo son los que han visto el tema, eso es lo que correspondía. El presidente era encargado siempre y cuando fuera presidente del Congreso. Desde el 26 julio ya no lo es, así que lo que correspondía era dejar la banda”, declaró a la prensa la congresista de Acción Popular.“Acá no hay ningún desaire. Se está elaborando un comunicado que informará que ese era el procedimiento, yo no tuve nada que ver con el protocolo. Él debió mandar la banda ayer, pero quiso llevarlo él. Eso es todo lo que ha pasado”, agregó.Francisco Sagasti, últimas noticias:María del Carmen Alva: “No ha habido ningún desaire a Sagasti”Susel Paredes: “Ha sido un maltrato innecesario al presidente Francisco Sagasti”Guzmán sobre entrega de banda presidencial: Inaceptable el maltrato a Francisco SagastiNewsletter Política LRSuscríbete aquí al boletín Política La República y recibe a diario en tu correo electrónico las noticias más destacadas de los temas que marcan la agenda nacional.Recibe las noticias de La República en Google NewstemasFrancisco SagastiMaría del Carmen AlvaAcción PopularJorge NietoCongreso del Perú",larepublica,2021-07-28 20:40:05.305000+00:00
28,¿Quiénes son los hijos del presidente Pedro Castillo?,"PolíticaPedro Castillo: ¿quiénes son los hijos del nuevo presidente de la República?Política LRPolitica_LRediciondigital@glr.pe28 Jul 2021 | 15:37 hActualizado el 28 de Julio 2021 | 15:37 hLilia Paredes con sus hijos Alondra, Jennifer y Arnold. Foto: ANDINA/ Andrés ValleLilia Paredes, esposa del actual mandatario, docente de educación inicial, indicó que su familia siempre tiene que estar unida. PublicidadLa esposa de Pedro Castillo, sus hijos, sus padres y sus hermanos asisten a la ceremonia de toma de mando que se realiza en el Congreso de la República. Lilia Paredes, esposa el mandatario electo, así como sus hijos Jennifer, Arnold y Alondra, llegaron de Cajamarca el pasado domingo.En la sede del poder Legislativo también se encuentran el padre del mandatario electo, Ireño Castillo Núñez; su madre, Mavila Terrones, así como sus hermanos.¿Quiénes son los hijos de Pedro Castillo?Hasta el momento los dos hijos de Castillo Terrones no han sido expuestos a la vida pública. Sin embargo, se conoce que Arnold tiene 16 y Alondra 6 años de edad. En recientes declaraciones ambos han expresado lo buen padre que ha sido el presidente.¿Quién es Jennifer Paredes?Jennifer es hermana de Lilia Paredes, esposa del mandatario. Ella es egresada de la Universidad Nacional de Cajamarca y bachiller en Administración de Empresas; y el presidente electo la ha adoptado como hija propia.La madre de la Lilia falleció a temprana edad, por lo que la menor fue criada por la esposa de Pedro Castillo y acogida como una hija por el mandatario electo cuando ambos formalizaron una relación que sostenían desde el colegio.Lilia Paredes, esposa del actual mandatario, docente de educación inicial, indicó que su familia siempre tiene que estar unida por eso vivirán en Lima al lado de Castillo.Biografía de Pedro CastilloJosé Pedro Castillo Terrones nació en 1969 en el poblado de Puña, ubicado en Cajamarca. Estudio la carrera de Educación en la Universidad César Vallejo, recinto en el que también obtuvo una maestría en Psicología Educativa.En 2005 inició su carrera política al convertirse en miembro del Comité de Cajamarca del partido político Perú Posible, mientras que 12 años más tarde se hizo conocido por ser el dirigente que lideró la huelga magisterial durante el Gobierno de Pedro Pablo Kuczynski. En ese entonces reclamaban el pago de la deuda social a los maestros, el incremento de los sueldos y la evaluación docente con capacitación previa.En el 2020 confirmó su participación para las elecciones presidenciales del 11 de abril de 2021 por Perú Libre, partido fundado por el exgobernador regional de Junín, Vladimir Cerrón.Pedro Castillo, últimas noticias:Pedro Castillo: familiares del presidente llegaron al Congreso de la RepúblicaCastillo: “Juro por los pueblos del Perú, por un país sin corrupción y por una nueva Constitución”Recibe las noticias de La República en Google NewstemasPedro castilloPedro Castillo TerronesPerúFiestas PatriasBicentenario",larepublica,2021-07-28 20:37:50.460000+00:00
