,title,content,site,publish_date
0,Modesto Montoya: “Primera vez que un presidente habla de ciencia y tecnología en su mensaje”,"PolíticaModesto Montoya: “Primera vez que un presidente habla de ciencia y tecnología en su mensaje”Política LRPolitica_LRediciondigital@glr.pe28 Jul 2021 | 23:10 hActualizado el 28 de Julio 2021 | 23:10 hMontoya expresó su apoyo al mensaje de Pedro Castillo sobre ciencia y tecnología. Foto: Grace Mora/URPI-LRAunque negó que vaya a ocupar algún cargo ministerial, el científico peruano destacó el hecho de que Pedro Castillo se haya referido a su campo durante su primer mensaje a la nación. PublicidadPedro Castillo ya es presidente del Perú y dio este miércoles 28 su primer mensaje a la nación. Varios fueron los puntos tratados por el nuevo mandatario en su alocución, incluyendo el campo de la ciencia y la tecnología, ante lo cual el físico Modesto Montoya mostró su satisfacción luego de escuchar las palabras del nuevo jefe de Estado.“Los científicos del Perú que están en el extranjero me han comunicado que están muy satisfechos por el anuncio del presidente de la República sobre la creación del Ministerio de Ciencia y Tecnología”, indicó Montoya a La República a las afueras del Centro de Convenciones de Lima.Sobre el desarrollo de la carrera de investigador, el físico peruano señaló su importancia, puesto que permite “recuperar parte del grupo humano que está trabajando en potencias extranjeras, y retener a los jóvenes que no tienen plaza acá y se quieren ir”.Al ser interrogado sobre la posibilidad de encabezar la nueva cartera de Ciencia y Tecnología, Montoya Zavaleta indicó que primero el Congreso debe aprobar la propuesta del Ejecutivo. “No hay nada que hablar del cargo de ministro. Nosotros (los científicos) estamos luchando para que haya un ministerio, quien lo encabece será decisión del presidente”, declaró.Además, recordó el retraso que se ve en el Perú en cuanto a producción científica al lado de países vecinos como Chile y Ecuador. El primero “tiene 10 veces más científicos por millón de habitantes”; mientras que el segundo ya publica el doble de contenidos especializados, “teniendo la mitad de población que tiene el Perú”, explicó.Por último, señaló que es la “primera vez que un presidente habla de ciencia y tecnología en su mensaje al Congreso de la República”.¿Cuál fue mensaje de Pedro Castillo sobre ciencia y tecnología?Tal como lo había anunciado en campaña, Pedro Castillo reiteró que su gobierno propondrá la creación del Ministerio de Ciencia, Tecnología e Innovación Tecnológica. Afirmó que “con este se potenciará la generación de conocimiento necesario para el desarrollo y la independencia tecnológica del Perú”.“Asimismo, será necesario estudiar la posibilidad de una carrera del investigador científico y tecnológico para incorporar a los talentos egresados y repatriar a los que migraron por falta de oportunidades”, comentó.Pedro Castillo, últimas noticias:Pedro Castillo: los puntos centrales de su primer mensaje presidencialPampa de la Quinua: ¿qué representa el lugar en el que jurará simbólicamente Pedro Castillo?“Los nadies”: ¿a qué hace referencia la frase de Dina Boluarte al jurar como vicepresidenta?Newsletter Política LRSuscríbete aquí al boletín Política La República y recibe a diario en tu correo electrónico las noticias más destacadas de los temas que marcan la agenda nacional.Recibe las noticias de La República en Google NewstemasPedro castilloPedro Castillo TerronesCienciaTecnologíaMensaje Presidencial",larepublica,2021-07-29 04:10:46.535000+00:00
1,La República realizó su primer Twitter Spaces: analizamos el mensaje presidencial,"PolíticaLa República realizó su primer Twitter Spaces: analizamos el mensaje presidencialPolítica LRPolitica_LRediciondigital@glr.pe28 Jul 2021 | 23:04 hActualizado el 28 de Julio 2021 | 23:04 hLa República evaluó los ángulos positivos y negativos del primer discurso presidencial de Pedro Castillo a través de Twitter Spaces. Foto: La RepúblicaCon la participación de cuatro especialistas en política, economía, salud y educación, La República analizó el primer mensaje a la nación del mandatario, Pedro Castillo.  PublicidadEstreno. La República realizó su primer Twitter Spaces para analizar el mensaje presidencial. El espacio estuvo organizado por periodistas de LR Data y Verificador, nuestra unidad de fact-checking. Los invitados fueron José Alejandro Godoy, especialista en política; Angela Uyen, especialista en salud; Luis Alberto Arias, especialista en economía; y Julio Cáceda, especialista en educación. Durante la transmisión se presentaron los resultados de algunas frases verificables de Pedro Castillo.Este miércoles 28 de julio, el presidente de la República juró al cargo en las instalaciones del Congreso. Tras las ceremonia, el jefe de Estado se dirigió hacia el país y expuso las acciones y las políticas que aplicará su Gobierno para los próximos cinco años.PolíticaEn relación al contexto político del primer mensaje presidencial del presidente, Pedro Castillo, José Alejandro Godoy, magister en Ciencias Políticas y Gobierno, resaltó el inicio del discurso. “Es importante que un jefe de Estado haga un recuento histórico de lo que ha sido la lucha por la independencia y que tenga ese enganche entre el bicentenario y su propio periodo de Gobierno”, apuntó.Sin embargo, consideró que luego el mensaje tuvo ciertas similitudes con los de otros mandatarios y que algunas de las propuestas no fueron precisas. “Fue importante tener referencia a sostenibilidad y interculturalidad, pero sin ninguna reforma del Ministerio de Cultura y Ministerio del Ambiente que vaya más halla del nombre, eso no será posible”, destacó.Asimismo, sostuvo que Castillo puso paños fríos cuando tocó el tema de la asamblea constituyente con la que buscaría un cambio de constitución, principal promesa de campaña durante las elecciones. “Esa propuesta es muy parecida al modelo chileno no solo porque implica un cambio constitucional, sino también porque coloca una representación de pueblos indígenas”, agregó.Por otro lado, el especialista se pronunció sobre la posibilidad de la elección de Roger Najar como presidente del Consejo de Ministros y consideró que sería un pésimo mensaje para las mujeres del país.En ese sentido, Godoy afirmó que el hecho de que hasta el momento no se anuncie un gabinete es un error debido a que con el se podría saber si las propuesta presentes en el discurso pueden ser cumplidas o no. ”Ha sido un mensaje que al no tener los nombres puede perder un poco de fuerza”, concluyó.SaludAngela Uyen, asesora en políticas de salud, destacó el pronunciamiento del presidente, Pedro Castillo, sobre la lucha contra la pandemia del coronavirus en el país. “Me pareció positivo que dijera que se va a construir sobre lo avanzado en COVID-19 y en el tema de vacunación. Sobre todo cuando hubo esa confrontación, criticando al Gobierno de Francisco Sagasti”, opinó.A su vez, saludó que el primer mandatario hable sobre salud mental y la mejora de la atención primaria a través de la apertura de hospitales, aunque mencionó que hubiera sido ideal que especificara el número nosocomios que construirá, cuánto serán los equipos de asistencia y cómo se organizarán.Sobre la iniciativa de conseguir la vacunación del 70% de la población a fin de año, la especialista destacó que el Estado necesitará trabajar de la mano con los Gobiernos regionales y será necesario de una campaña de comunicación. “Me pareció importante que hable de la descentralización porque necesitarán recursos humanos y toque otros temas que son salud. Vivienda es salud, alimentación es salud. Todo esto es salud”, precisó.EconomíaLuis Alberto Arias, exdirector del Banco Central de Reserva del Perú (BCR), sostuvo que está de acuerdo con los puntos propuestos por Castillo durante su discurso presidencial.“Coincido con las prioridades. El mensaje comienza hablando de la pandemia, el sector salud, la reactivación económica y la educación. Creo que eso es fundamental en la economía porque son los problemas que hemos padecido y que la pandemia los ha hecho evidentes”, afirmó.Para Arias, el mensaje reveló que es importante para el presidente la participación estatal, pero advirtió que “si bien la intención es generar mayor competencia en el mercado, a veces la intervención del Estado en lo que funciona mal en el actual modelo económico podría originar una solución aun mas negativa”.Para el economista, las propuestas de Castillo necesitan una mayor cantidad financiamiento que debería concluir con una reforma tributaria; sin embargo, esta no apareció durante el mensaje. “No se ha mencionado la reforma que es necesaria para financiar todas las promesas hechas hoy”, acotó.Finalmente, declaró que la tranquilidad en los mercados estará muy vinculada con la presentación del equipo ministerial. “Es muy importante para el buen financiamiento del Estado la sinergia entre las autoridades, que es asegurada por el trabajo en conjunto de todos los ministros y que el gabinete sea coherente con las políticas establecidas por el presidente”, determinó.EducaciónJulio Cáceda, magister en Desarrollo Humano de la PUCP, resaltó que no quedaron muy claras las razones por las que debería se declarada en emergencia la educación y también existen dudas sobre la iniciativa para duplicar el presupuesto del sector.“Me parece que es muy complicado lograrlo. Hay preguntas que hacerse. ¿A qué sector se le quita? Ya que los recursos son limitados o si se tiene la capacidad actual para gastar ese dinero. Es un retórica bonita el incremento del presupuesto, pero también esta el cómo, de dónde y hasta dónde?”, refirió.Asimismo, sostuvo que es positivo el fortalecimiento de la formación inicial, el anuncio de la revalorización docente a través de los estímulos y que en la áreas rurales existan institutos pedagógicos. Aunque, hizo hincapié en que durante el discurso estuvo ausente la reforma magisterial y la meritocracia en la carrera.Finalmente, sobre el ingreso libre a las universidades, el especialista dijo que era un problema. “Los exámenes de admisión son un filtro de habilidades cognitivas para saber si puedes mantenerte en la educación superior y sin él habrá mucha deserción como sucede en Argentina”, concluyó.Política, últimas noticias: Mensaje a la nación de Pedro Castillo: revive el discurso presidencial de este 28 de julioUrresti: “El discurso de Pedro Castillo no fue lo radical que se esperaba”Castillo: “Debemos contar con una legislación que desaliente la criminalidad, no como la actual”Recibe las noticias de La República en Google NewstemasPedro Castillo TerronesMensaje Presidencial",larepublica,2021-07-29 04:04:15.285000+00:00
2,Pedro Castillo: “Luchemos por la salud y por la vida antes de luchar por otra cosa”,"PolíticaPedro Castillo: “Luchemos por la salud y por la vida antes de luchar por otra cosa”Política LRPolitica_LRediciondigital@glr.pe28 Jul 2021 | 23:00 hActualizado el 28 de Julio 2021 | 23:00 hCastillo dio un mensaje luego de que fuera saludado por autoridades que representan a países del extranjero. Foto: Presidencia PerúFrente a representantes de países del extranjero, el mandatario también hizo un llamado a que se haga un esfuerzo por invertir menos en armas y hacer lo posible para que todos tengan acceso a la educación. PublicidadEl presidente Pedro Castillo dio un discurso frente a las misiones especiales extranjeras y autoridades nacionales, y pidió que se haga un esfuerzo para que todas las personas tengan acceso a la educación. También exhortó a priorizar la lucha por un buen sistema de salud.“Hagamos un esfuerzo por la más amplia unidad de los pueblos del mundo. Hagamos un esfuerzo por invertir menos en armas, en cosas que no producen. Ocupemos más nuestro esfuerzo en encaminar para que los hermanos de todo el mundo tengan acceso a la educación y a la salud, que hoy esta pandemia ha desnudado muchísimas realidades. (...) Hay que garantizar que nuestros hijos y las familias del Perú y el mundo tengan confianza en sus autoridades”, expresó el mandatario.Además., señaló que no solamente se debe declarar la guerra a la pandemia de la COVID-19, sino también “a ciertas indiferencias” y “a ciertos distanciamientos”.Asimismo, exhortó a que los niños tengan una “educación de calidad como derecho constitucional” y que también tengan acceso a la salud “sin miramientos, sin discriminaciones y sin privilegios”.Por último, solicitó que se dejen de lado las diferencias y que “no miremos distinciones de razas, no miremos distinciones de lenguas, de posiciones políticas, de posiciones religiosas”. “Luchemos por la salud y la vida antes de luchar por otra cosa”, prolongó.Castillo juró el cargo de presidente de la RepúblicaPedro Castillo asumió el puesto de presidente de la República este miércoles 28 de julio tras jurar el cargo en el Congreso de la República, frente a la Representación Nacional.También dio un discurso y anunció que presentará un proyecto para una nueva Constitución, pero siempre respetando los mecanismos legales que brinden la actual carta magna.“La asamblea constituyente del bicentenario debe ser plurinacional, popular y con paridad de género. Su composición tiene que incluir a candidatos propuestos por las organizaciones políticas inscritas, a porcentajes de candidatos provenientes de los pueblos indígenas, nativos y originarios, del pueblo afroperuano y de candidaturas independientes”, añadió.De igual forma, manifestó que su Gobierno se ha planteado vacunar al 70% de la población de acá a fin de año, que va a declarar la educación en estado de emergencia y que no pretende estatizar la economía del país.Pedro Castillo, últimas noticias: Pedro Castillo: los puntos centrales de su primer mensaje presidencialKeiko Fujimori se pronuncia tras asunción de Pedro Castillo como presidente de la RepúblicaJosé Godoy: “Hubo algunos anuncios un poco controvertidos en el mensaje de Pedro Castillo”Newsletter Política LRSuscríbete aquí al boletín Política La República y recibe a diario en tu correo electrónico las noticias más destacadas de los temas que marcan la agenda nacional.Recibe las noticias de La República en Google NewstemasPedro castilloPedro Castillo TerronesPerú LibrePoder Ejecutivo",larepublica,2021-07-29 04:00:58.470000+00:00
3,"Dina Boluarte: ¿a quiénes se refiere la vicepresidenta con ""los nadies"" cuando juró?","Política“Los nadies”: ¿a qué hace referencia la frase de Dina Boluarte al jurar como vicepresidenta?Política LRPolitica_LRediciondigital@glr.pe28 Jul 2021 | 22:29 hActualizado el 28 de Julio 2021 | 22:29 hDina Boluarte juró al cargo de vicepresidenta este miércoles 28 de julio en el Congreso de la República. Foto: presidenciaLa vicepresidenta del Perú juró al cargo en las instalaciones del Congreso de la República dejando una frase que se volvió viral en las redes sociales. PublicidadDina Boluarte juró este miércoles 28 de julio al cargo como vicepresidenta de la República del Perú en las instalaciones del Congreso de la República. Durante el juramento, la funcionaria sorprendió a más de uno al decir: “Por los nadies, por aquellos que tenían voz y se la quitaron, y por una patria soberana abrazada en un solo corazón. Sí, juro”.Esta frase se volvió viral en la redes sociales. Los internautas querían saber a qué hacía referencia la nueva vicepresidenta con las palabras vertidas en su discurso.Dina Boluarte posteó su frase en las redes sociales. Foto: captura Twitter.De acuerdo a la Fundéu-RAE (fundación patrocinada por la Agencia EFE y la Real Academia Española), la palabra “Los nadies” hace referencia a las personas que parecen invisibles para la sociedad.Algunos usuarios también relacionaron el término con el poema Los nadies de Eduardo Germán Galeano, periodista y escritor uruguayo, considerado uno de los prosistas más influyentes de la izquierda latinoamericana.Poema Los NadiesSegún lo expuesto, la expresión de Dina Boluarte hace referencia a los sectores olvidados del Perú. De la misma forma, el presidente del Perú, Pedro Castillo Terrones, en su mensaje a la nación, dirigió su saludo a los descendientes de los pueblos originarios del paísEl mandatario Pedro Castillo afirmó que “es la primera vez que nuestro país será gobernado por un campesino“. En esa corriente, calificó que su llegada a Palacio de Gobierno representa “un gobierno del pueblo que ha llegado para gobernar con el pueblo y para el pueblo”. sentencióCastillo Terrones, en marco del Bicentenario del Perú, se refirió al inicio de la etapa republicana en 1821, hito histórico que —según argumentó— no trajo mejoras reales para la mayoría de peruanos. “Los denominados aborígenes continuaron siendo explotados como ciudadanos de segunda categoría para el erario de la flamante República del Perú”, remarcó.Política, últimas noticias:Pedro Castillo recibió la banda presidencial y dio primer mensaje a la naciónCastillo: “Debemos contar con una legislación que desaliente la criminalidad, no como la actual”Pedro Castillo: Crearemos un millón de empleos en el primer año de gobiernoNewsletter Política LRSuscríbete aquí al boletín Política La República y recibe a diario en tu correo electrónico las noticias más destacadas de los temas que marcan la agenda nacional.Recibe las noticias de La República en Google NewstemasDina BoluartePedro castilloPedro Castillo Terrones",larepublica,2021-07-29 03:29:18.012000+00:00
4,Verónika Mendoza sobre mensaje presidencial: “Se ha hecho una reivindicación histórica a los sectores excluidos”,"PolíticaVerónika Mendoza: “Se ha hecho una reivindicación histórica a los sectores excluidos”Política LRPolitica_LRediciondigital@glr.pe28 Jul 2021 | 22:28 hActualizado el 28 de Julio 2021 | 22:28 hVerónika Mendoza indicó que el mensaje de Pedro Castillo se centra en las necesidades de la población. Foto: Grace Mora/URPI-LRLa excandidata presidencial dijo que el presidente Pedro Castillo tiene la voluntad política para atender las necesidades de la población olvidada. PublicidadCon información de Grace Mora/LR.La exaspirante presidencial del Juntos por el Perú, Verónika Mendoza, se refirió este miércoles 28 de julio al mensaje presidencial de Pedro Castillo tras jurar en el cargo como presidente de la República por el periodo 2021-2026. Según dijo, “se ha hecho una reivindicación histórica a los sectores excluidos, silenciados en estos 200 años de República”.La lideresa de Nuevo Perú, tras ser abordada por los medios de comunicación, mencionó que la llegada de Castillo Terrones a Palacio de Gobierno será de vital importancia para atender las demandas de la población que se encontraba olvidada.“Ha llegado un Gobierno del pueblo que va atender sus demandas, que los va abrazar, que los va a acoger y creo que es lo central del mensaje del presidente Pedro Castillo, ya que ha anunciado un nuevo tiempo histórico en que todas las voces sean escuchadas, en que todas las culturas, las lenguas, las tradiciones sean acogidas, abrazadas y reconocidas”, remarcó Verónica Mendoza.Sobre el gabinete ministerial que elegirá Pedro Castillo en las próximas horas en el marco del bicentenario, Mendoza dijo que se debe tener paciencia, puesto que existe voluntad política para hacer cumplir las propuestas manifestadas en el mensaje a la nación.“Con respecto a los ministros, hay que ser pacientes y esperar los nombres que el presidente dará para implementar con lo que ha dicho (mensaje de la nación), pero lo importante es su voluntad política en las propuestas que ha transmitido al país el día de hoy”, apuntó Verónika Mendoza.Se destaca que las congresistas que forman parte del grupo parlamentario Juntos por el Perú enviaron un mensaje al jefe de Estado, Pedro Castillo, para invocarle a que el gabinete del bicentenario esté conformado por ministros y ministras que reivindiquen las propuestas.Juntos por el Perú a Pedro CastilloVerónika Mendoza, últimas noticias:Mendoza: “Como lo dijo el presidente Castillo, es tiempo de reconstruir la unidad nacional”Isabel Cortez: “200 años han tenido que pasar para que uno de nosotros asuma la presidencia”JP a Castillo: “Esperamos que el gabinete tenga ministros que reivindiquen sus propuestas”Newsletter Política LRSuscríbete aquí al boletín Política La República y recibe a diario en tu correo electrónico las noticias más destacadas de los temas que marcan la agenda nacional.Recibe las noticias de La República en Google NewstemasVerónika MendozaJuntos Por el Perú",larepublica,2021-07-29 03:28:09.410000+00:00
5,Congresistas piden no incluir en el gabinete a personas involucradas en violencia de género,"PolíticaCongresistas piden no incluir en el gabinete a personas involucradas en violencia de géneroPolítica LRPolitica_LRediciondigital@glr.pe28 Jul 2021 | 21:38 hActualizado el 28 de Julio 2021 | 21:38 h“El bicentenario de la República debe iniciarse dando mensajes de compromiso con las mujeres de nuestra patria”, expresa la carta. Foto: composición LRLa congresista Flor Pablo Medina anunció que las parlamentarias firmaron una carta para exhortar al presidente Castillo que el Gobierno no esté conformado por agresores.  PublicidadA través de sus redes sociales, la congresista Flor Pablo Medina del Partido Morado informó que varias congresistas han firmado una carta, donde exhortan al presidente Pedro Castillo a no incluir en su gabinete ministerial a personas vinculadas con actos de violencia contra las mujeres, niñas y niños.“El bicentenario de la República debe iniciarse dando mensajes de compromiso con las mujeres de nuestra patria”, finaliza la misiva en la que figura la firma de las parlamentarias Susel Paredes, Adriana Tudela, Mary Acuña, Patricia Juárez, Flor Pablo Medina, entre otras.Carta firmada por congresistas en contra de personas involucradas en casos de violencia de género. Foto: TwitterEl anuncio se da luego de que Roger Nájar sea uno de los voceados para ser el nuevo presidente del Consejo de Ministros cuando tiene graves denuncias. El también coordinador del “Plan Bicentenario, Perú Libre de corrupción” tuvo una hija con una menor de 14 años cuando él tenia 30 en 1987, pero en esa época la legislación todavía no lo consideraba delito, además no quiso pagar la manutención de la bebé.Las actuales congresistas no han sido las únicas en pedir que no se incluyan a personas vinculadas con casos de violencia de género en el Gobierno. Las exparlamentarias Indira Huilca y Marisa Glave también han sido firmes y claras en decir que no se aceptará agresores en el poder Ejecutivo.“No más impunidad en un país justo. Que la esperanza de un nuevo y mejor Perú se vea reflejado en quienes serán parte del Gobierno. Exigimos un Gobierno sin agresores. Perú libre de agresores”, escribió Huilca en su cuenta de Twitter.Por su lado, la excongresista de Nuevo Perú expresó: “Un cambio profundo, que ponga en el centro la justicia, parte de algo básico: no apañar a un agresor. Si quieren ir más allá del discurso y avanzar en una verdadera transformación, el Gobierno de Pedro Castillo debe ser un Gobierno sin agresores en un Perú libre de agresores”, tuiteó Glave.Pedro Castillo, últimas noticias:Pedro Castillo EN VIVO HOY 28 de julio: últimas noticias tras la toma de mando“El Estado asumirá la rehabilitación integral de las víctimas de violencia sexual”, anunció Pedro CastilloNewsletter Política LRSuscríbete aquí al boletín Política La República y recibe a diario en tu correo electrónico las noticias más destacadas de los temas que marcan la agenda nacional.Recibe las noticias de La República en Google NewstemasPedro castilloViolencia contra la mujerViolencia de género",larepublica,2021-07-29 02:38:35.682000+00:00
