,title,content,site,publish_date
71,Mirtha Vásquez sobre su gestión en la presidencia del Congreso: Primó la sensatez y el respaldo de la población,"PolíticaMirtha Vásquez sobre su gestión en la presidencia del Congreso: Primó la sensatez y el respaldo de la poblaciónPolítica LRPolitica_LRediciondigital@glr.pe28 Jul 2021 | 10:08 hActualizado el 28 de Julio 2021 | 10:35 hVásquez aseguró que desde su posición en el Congreso ha luchado por lo derechos laborales de los trabajadores. Foto: La RepúblicaA través de un video, rindió cuentas sobre los objetivos planteados, lo hecho durante su periodo y lo que considera pendiente para el Parlamento.  PublicidadLa expresidenta del Congreso, Mirtha Vásquez, agradeció a la ciudadanía “por su confianza y respaldo” y rindió cuentas sobre su trabajo desde que asumió el cargo en noviembre de 2020.“Gracias por su confianza y respaldo durante este tiempo. En el siguiente video, les rindo cuentas de mi labor como Presidenta del Congreso, en la que buscamos legislar en defensa de derechos, garantizar una transición democrática y promover una gestión eficiente y transparente”, escribió Vásquez en su cuenta de Twitter.En el video señalado, la parlamentaria del Frente Amplio inició su rendición de cuentas haciendo referencia al contexto de crisis política en el que pasó a encabezar el Legislativo.“A fines del 2020, mientras enfrentábamos la pandemia, con miles de jóvenes en las calles protestando contra la crisis política, juramenté como presidenta del Congreso. Fue un momento difícil, pero asumimos el compromiso”, declaró.“Junto con mi equipo, nos propusimos dirigir el Parlamento generando consensos mínimos que puedan garantizar la transición democrática hacia un nuevo gobierno. Los cuatro pedidos fallidos e injustificados de censura muestran lo difícil que ha resultado, pero también que ha primado la sensatez y el respaldo de la población”, añadió.Por otro lado, indicó que su equipo buscó atender demandas urgentes como la lucha contra la pandemia, la corrupción y la defensa de los derechos de los sectores menos favorecidos.“Lograrlo no dependía únicamente de mí, pero hemos logrado aprobar normas importantes como la que elimina la inmunidad parlamentaria, (la norma de) el acceso equitativo a las vacunas, la ley contra el acoso político, la de seguridad alimentaria, y la que elimina progresivamente el CAS (Régimen Especial de Contratación Administrativa de Servicios)”, refirió.Asimismo, indicó que durante su periodo se resolvieron acusaciones constitucionales de casos emblemáticos como los de los exmagistrados del antiguo Consejo Nacional de la Magistratura, el del excongresista Édgar Alarcón, y el de la inhabilitación del expresidente Martín Vizcarra.“Nos propusimos administrar el Congreso de manera honesta, eficiente, transparente y cuidando a los trabajadores frente a la pandemia. Fortalecimos el control interno, implementamos la contratación virtual, la votación electrónica en los plenos, y creamos un comité contra el hostigamiento sexual”, señaló sobre los cambios planteados para el funcionamiento del propio Parlamento.Finalmente, Mirtha Vásquez expuso los que considera como retos pendientes para los legisladores entrantes. “Este Congreso tiene una deuda con las demandas de los pueblos indígenas, la acción frente al cambio climático, y los derechos de las mujeres y la comunidad LGTBIQ+”, sostuvo.Mirtha Vásquez asumió como presidenta del Congreso de manera interina el 17 de noviembre de 2020, tras la crisis generada a raíz del gobierno de facto de Manuel Merino.Congreso, últimas noticias:Alva: “Ratificamos desde el Congreso nuestro compromiso con la democracia”Rocío Silva Santisteban: “Esperamos que el Congreso no sea obstruccionista”José Jerí sobre nuevo gabinete ministerial: “Esperamos que no tenga sesgo ideológico”Newsletter Política LRSuscríbete aquí al boletín Política La República y recibe a diario en tu correo electrónico las noticias más destacadas de los temas que marcan la agenda nacional.Recibe las noticias de La República en Google NewstemasMirtha VásquezCongreso del Perú",larepublica,2021-07-28 15:35:15.122000+00:00
72,Piero Corvetto por bicentenario del Perú: “Cultivemos respeto y tolerancia”,"PolíticaPiero Corvetto saluda el bicentenario del Perú: “Cultivemos respeto y tolerancia”Política LRPolitica_LRediciondigital@glr.pe28 Jul 2021 | 10:07 hActualizado el 28 de Julio 2021 | 10:07 hCorvetto saludó a los peruanos por el Bicentenario. Foto: Captura TwitterEl jefe de la ONPE utilizó sus redes sociales para enviar su saludo por el bicentenario del Perú. En el mismo hizo un llamado a la unión de los peruanos. PublicidadPiero Corvetto, jefe de la Oficina Nacional de Procesos Electorales (ONPE), envió un saludo a la ciudadanía peruana por motivo de las Fiestas Patrias de 28 de julio y el Bicentenario de la Independencia del Perú.En su mensaje, publicado en su cuenta de Twitter, Corvetto hizo un llamado a la unión de todos los peruanos. Además, instó a la ciudadanía a cultivar valores que nos permitan vivir en democracia.“Feliz bicentenario, Perú. Que la unión, la honestidad, el respeto, la tolerancia, la libertad y la solidaridad sean valores que cultivemos para alcanzar la República que tanto anhelamos. Feliz 28 de julio”, publicó el jefe de la ONPE en sus redes sociales.Piero Corvetto instó a la unidad en mensaje por 28 de julio. Foto: Captura TwitterCabe recordar que Corvetto jugó un papel importante como jefe de la ONPE en el proceso electoral que terminó definiendo el triunfo en los comicios presidenciales de Pedro Castillo, candidato de Perú Libre, sobre la lideresa de Fuerza Popular, Keiko Fujimori.El computo final de la ONPE arrojó que Pedro Castillo obtuvo el 50,125% de los votos, mientras que Keiko Fujimori alcanzó el 49,875%. Este conteo llevó a la proclamación de Pedro Castillo como presidente de la República por parte del JNE, luego de varios días de resolución de apelaciones y pedidos de nulidad.Corvetto destacó, además, el Informe de la misión de expertos electorales de la Unión Europea, el cual calificó a las elecciones realizadas en nuestro país como “creíbles e íntegras”, por lo que felicitó el trabajo del Jurado Nacional de Elecciones (JNE) y la Oficina Nacional de Procesos Electorales (ONPE).Política, últimas noticiasIzquierda en el Perú: la primera vez en el GobiernoPedro Castillo asume hoy el gobierno del bicentenarioEN VIVO: Pedro Castillo asumirá este miércoles 28 de julio la presidencia del PerúNewsletter Política LRSuscríbete aquí al boletín Política La República y recibe a diario en tu correo electrónico las noticias más destacadas de los temas que marcan la agenda nacional.Recibe las noticias de La República en Google Newstemaspiero corvettoONPEFiestas Patrias28 de Julio",larepublica,2021-07-28 15:07:55.346000+00:00
73,César Hinostroza continuará siendo investigado por crimen organizado,"PolíticaCésar Hinostroza continuará siendo investigado por crimen organizadoAlonso Collantesacollantes_1096alonso.collantes@glr.pe28 Jul 2021 | 10:07 hActualizado el 28 de Julio 2021 | 10:07 hCésar Hinostroza es investigado como uno de los presuntos cabecillas de Los Cuellos Blancos del Puerto. Foto: EFEExjuez César Hinostroza intentó anular la formalización de un caso en su contra por Los Cuellos Blancos del Puerto, pero el Poder Judicial negó su recurso.  PublicidadLa investigación por organización criminal y otros delitos en el caso Cuellos Blancos del Puerto contra César Hinostroza Pariachi seguirá su curso en la Primera Fiscalía Suprema Transitoria Anticorrupción. La decisión llegó a inicios de esta semana por parte del juez supremo Hugo Núñez Julca al rechazar un recurso de tutela de derechos de Hinostroza en el que solicitaba que se anule la formalización de la investigación preparatoria abierta en su contra en marzo de este año, y que aprobado por el Poder Judicial en mayo. Según la defensa de Hinostroza, existían dos investigaciones por los mismos hechos, delitos y fundamentos en su contra, por lo cual debía anularse la continuación de una de ellas que contenía los ilícitos de organización criminal y patrocinio ilegal.  Pj Niega Recurso de Cesar Hinostroza by Alonso Collantes on ScribdPara la Fiscalía, en cambio, no se afectaron los derechos de César Hinostroza, pues si bien existía la duplicidad en el caso, ya se había dispuesto la separación de uno de ellos. Así, se informó que se había solicitado ya “la desacumulación del Expediente 14-2021 para ser acumulado al Expediente 4-2018, ante ello se puede decir que no se ha afectado ningún derecho porque cuando existan investigaciones paralelas se acumularán para que no exista doble persecución”. El magistrado Núñez Julca resolvió así que el recurso de tutela de derechos formulado por César Hinostroza no era el adecuado para cuestionar la formalización del caso en su contra. Además sostuvo en su decisión que, según el Acuerdo Plenario 4-2010, la investigación en etapa preparatoria “no puede ser impugnada ni dejada sin efecto por el Juez de la Investigación Preparatoria”. Tampoco puede anularse ni dejar sin efecto una decisión del Ministerio Público, indicó en su resolución el juez supremo. Además, recomendó que si el fin de Hinostroza era cuestionar la formalización del caso, podía solicitarlo en otra instancia mediante apelación, agregandoque no hubo vulneración a sus derechos. Investigación contra Hinostroza En marzo la investigación preliminar contra Hinostroza pasó a etapa preparatoria para seguir investigándolo por un plazo máximo de 36 meses. Entre los delitos imputados estaban los de organización criminal y patrocinio ilegal. Por el primer delito, la Fiscalía sostiene que Hinostroza Pariachi fue uno de los líderes de los Cuellos Blancos del Puerto, red que tenía como fin el nombramiento de jueces y fiscales a través de influencias en el ahora desaparecido Consejo Nacional de la Magistratura. Por otra parte, sobre el delito de patrocinio ilegal se le imputó al investigado “haber gestionado ante Walter Ríos Montalvo, expresidente de la Corte Superior de Justicia del Callao, el nombramiento irregular de Maico Reyner Fernandez Morales como Juez Supernumerario del Callao”. El exmagistrado que integraba la Corte Suprema de Justicia afronta un proceso de extradición en España, donde también espera que se resuelva una solicitud suya para tener asilo en este país europeo. La Sala de lo Contencioso-Administrativo de la Audiencia Nacional aún no se pronuncia al respecto. Cesar Hinostroza, últimas noticiasJNJ destituye a juez supremo que solicitó favor a César Hinostroza
Fiscalía informa que tomó declaraciones de Hinostroza esta mañana
César Hinostroza: Poder Judicial evaluará tutela de derechos este viernes 28
Newsletter Política LRSuscríbete aquí al boletín Política La República y recibe a diario en tu correo electrónico las noticias más destacadas de los temas que marcan la agenda nacional.Recibe las noticias de La República en Google News",larepublica,2021-07-28 15:07:54.074000+00:00
74,Evo Morales: Coincidimos en la obligación política de cuidar y defender a Pedro Castillo de acciones desestabilizadoras,"PolíticaEvo Morales: Coincidimos en la obligación política de cuidar y defender a Castillo de acciones desestabilizadorasPolítica LRPolitica_LRediciondigital@glr.pe28 Jul 2021 | 9:36 hActualizado el 28 de Julio 2021 | 9:36 hEvo Morales espera que Castillo impulse el megapuerto en Ilo. Foto: Gianella Aguirre / URPI -LREl expresidente de Bolivia aseguró que los movimientos sociales tienen un gran interés en una agenda binacional entre su partido y el de Perú Libre. PublicidadEl ex jefe de Estado de Bolivia Evo Morales se reunió con el presidente electo Pedro Castillo y otros dirigentes bolivianos en el local partidario de Perú Libre y aseguró que coinciden en cuidar y defenderlo contra las acciones desestabilizadoras.“Con el nuevo presidente de Perú, coincidimos en la obligación política de los movimientos sociales, de cuidar y defender a Luis Arce y a Pedro Castillo de las acciones desestabilizadoras”, escribió en su cuenta de Twitter.De acuerdo a Morales, en la reunión que sostuvo con el representante del lápiz recordaron sus luchas cuando Castillo ejercía la docencia y el boliviano cuando era campesino.“Estamos orgullosos de su elección como presidente del Perú. Somos pueblo y hermanos y nos acompañamos”, mencionó.Finalmente, espera que su partido el Movimiento al Socialismo - Instrumento Político (MAS-IPSP) junto a Perú Libre puedan formar una agenda binacional bajo el liderazgo de Castillo y el mandatario boliviano.“Los movimientos sociales tenemos gran interés en una agenda binacional entre el MAS-IPSP y Perú Libre bajo el liderazgo de los presidentes Luis Arce y Pedro Castillo que impulse integración caminera, corredor bioceánico, megapuerto en Ilo e industrialización del litio”, comentó.Tuit de Morales. Foto: captura de TwitterDina Boluarte se reunió con fundador de Podemos EspañaDina Boluarte también sostuvo una reunión con un dirigente de otro país. La vicepresidenta calificó de “gratificante” la visita de Juan Carlos Monedero, uno de los fundadores del partido Podemos España, quien llegó al país para el bicentenario del Perú.“Ha sido gratificante la visita de Juan Carlos Monedero, fundador de Podemos en España. Hemos conversado sobre lo que nuestras organizaciones pueden alcanzar y el futuro del Perú en la escena internacional. ¡Bienvenido!”, escribió en su cuenta de Twitter.Política, últimas noticias:José Jerí sobre nuevo gabinete ministerial: “Esperamos que no tenga sesgo ideológico”Dina Boluarte se reunió con fundador del partido Podemos EspañaNewsletter Política LRSuscríbete aquí al boletín Política La República y recibe a diario en tu correo electrónico las noticias más destacadas de los temas que marcan la agenda nacional.Recibe las noticias de La República en Google NewstemasEvo MoralesBoliviaPedro castilloPerú Libre",larepublica,2021-07-28 14:36:05.395000+00:00
75,Fiestas Patrias: RTV realiza cobertura especial por el Bicentenario del Perú,"PolíticaFiestas Patrias: RTV realiza cobertura especial por el Bicentenario del Perú Política LRPolitica_LRediciondigital@glr.pe28 Jul 2021 | 9:28 hActualizado el 28 de Julio 2021 | 9:28 hAugusto Álvarez Rodrich y Rosa María Palacios. Foto: captura/RTVCelebra este 28 de julio junto y conmemora el Bicentenario del Perú en una edición especial de La República y RTV.  PublicidadEste 28 de julio, La República y RTV con una cobertura especial conmemorarán los 200 años de libertad.La mesa de conducción liderada por Augusto Álvarez Rodrich y Rosa María Palacios detallan los incidentes de los actos oficiales como el de la misa Te Deum, donde Francisco Sagasti hará su última aparición como presidente en ejercicio, y el primer mensaje a la Nación del presidente de la República, Pedro Castillo Terrones, tras su asunción al poder.Tras el discurso en el Congreso, AAR y RMP junto a invitados especiales analizarán las debilidades y fortalezas del mensaje presidencial.Como parte de la celebración, la soprano Gladis Huamán presentará en exclusiva la interpretación de nuestro himno patrio en quechua, ashaninka, aimara, shipibo-kobino y castellano.RTV estará en el centro de la noticia para brindarles información seria y eficaz mediante su multiplataforma web y app.Pedro Castillo, últimas noticias:Pedro Castillo asume hoy el gobierno del bicentenarioPedro Castillo debe escoger al nuevo jefe del Comando Conjunto de las Fuerzas ArmadasIzquierda en el Perú: la primera vez en el GobiernoRecibe las noticias de La República en Google NewstemasRTV",larepublica,2021-07-28 14:28:22.147000+00:00
76,Oficializan pase al retiro del general César Astudillo,"PolíticaOficializan pase al retiro del general César AstudilloPolítica LRPolitica_LRediciondigital@glr.pe28 Jul 2021 | 9:26 hActualizado el 28 de Julio 2021 | 9:26 hEl general César Astudillo adelantó su pase al retiro que le tocaba en octubre. Foto: AndinaA través de una resolución suprema publicada en el diario oficial El Peruano, el presidente Francisco Sagasti da por concluido su servicio y agradece al ahora exjefe del Comando Conjunto de las Fuerzas Armadas. PublicidadEste miércoles 28 de julio se oficializó el pase al retiro del general César Augusto Astudillo Salcedo, ahora exjefe del Comando Conjunto de las Fuerzas Armadas, mediante una resolución suprema publicada en el diario oficial El Peruano.El oficio difundido señala que la causal de su baja es “a su solicitud”. Asimismo, se le agradece por “los importantes servicios prestados”. La disposición está firmada por el presidente Francisco Sagasti y la ministra de Defensa, Nuria Esparch.Como se informó, el último 23 de julio el general Astudillo envió un documento en el que solicitaba al Ejecutivo autorizar su baja, alegando que era por motivos personales. Su salida aún se daría en octubre de 2021, pero el Gobierno informó que aceptaría su renuncia.El exjefe del Comando Conjunto de las Fuerzas Armadas fue condecorado y ascendido por su participación en la Operación Chavín de Huántar, en 1997, por lo cual ocupó la Comandancia General del Ejército en 2017, designado por el expresidente Pedro Pablo Kuczynski.En el 2018, cuando sus funciones habían concluido, el exmandatario Martín Vizcarra lo nombró jefe del Comando Conjunto de las FF. AA. Tras cumplir su periodo en el 2020, el expresidente prolongó por un año más la gestión del general Astudillo, pero al darse durante el gobierno de facto del excongresista Manuel Merino, solo duró del 10 al 15 de noviembre.No obstante, el presidente de transición, Francisco Sagasti, lo ratificó en sus funciones y su periodo aún terminaría en octubre.Salida de Astudillo no está motivada por asunción de Pedro CastilloEl jefe de Estado Francisco Sagasti informó que la salida de Astudillo Salcedo no estaba motivada por la asunción del presidente electo Pedro Castillo Terrones, tal como se había rumoreado.“He hablado con el general Astudillo y no ha habido nada de eso, creo que tenemos gente que se imagina muchas cosas y desgraciadamente con esta imaginación sin ningún freno crea situaciones totalmente innecesarias de zozobra”, manifestó en diálogo con Latina.Política, últimas noticias:Izquierda en el Perú: la primera vez en el GobiernoEduardo Salhuana: “No se debe seguir en vendettas, vacancias y disoluciones”Dina Boluarte se reunió con fundador del partido Podemos EspañaNewsletter Política LRSuscríbete aquí al boletín Política La República y recibe a diario en tu correo electrónico las noticias más destacadas de los temas que marcan la agenda nacional.Recibe las noticias de La República en Google NewstemasFuerzas Armadas del PerúFrancisco SagastiPedro castillo",larepublica,2021-07-28 14:26:35.441000+00:00
77,Rocío Silva Santisteban: Esperamos que el Congreso no sea obstruccionista,"PolíticaRocío Silva Santisteban: “Esperamos que el Congreso no sea obstruccionista”Política LRPolitica_LRediciondigital@glr.pe28 Jul 2021 | 9:16 hActualizado el 28 de Julio 2021 | 9:43 hRocío Silva Santisteban advirtió sobre una inclinación de la Mesa Directiva hacia la oposición. Foto: capturaLa excongresista por el Frente Amplio alertó sobre una posible inclinación de la nueva Mesa Directiva del Congreso a favorecer a la oposición. PublicidadLa excongresista de la República Rocío Silva Santisteban expresó su preocupación en torno a una posible inclinación de la recientemente nombrada Mesa Directiva del Congreso para favorecer a los grupos que actuarán en oposición al régimen del presidente Pedro Castillo.“Ya se eligió a la Mesa Directiva del Congreso y lamentablemente no está conformada por el partido mayoritario. Más bien, los que están en la Mesa Directiva se pueden convertir rápidamente en oposición”, indicó en conversación con el programa Punto Noticias.La exparlamentaria del Frente Amplio, sustentó su cautela en la manera en que la lista que incluía a un miembro de Perú Libre no fue admitida para participar en la elección de la nueva Mesa Directiva.“La lista que presentó a gente del partido de Pedro Castillo tenía un integrante que no tenía bancada, entonces se hizo una interpretación ahí y se votó entre los 130 congresistas para ver si se admitía o no la lista. Y se votó en contra por una amplia mayoría. Eso significa que el Congreso va a estar en oposición y esperemos que no sea obstruccionista”, recalcó.Además, alertó sobre los problemas de gobernabilidad que tendrá Pedro Castillo en su gestión, en su mayoría propiciados por las actitudes generadas durante la segunda vuelta en un sector de la población.“La excandidata Keiko Fujimori hizo lo posible y lo imposible para que no se declare electo a Pedro Castillo y ha quedado como una persona absolutamente antidemocrática. Tener gobernabilidad va a ser bien difícil, porque se ha generado una especie de anticomunismo histérico y Pedro Castillo no es comunista. Hay un discurso diciendo que ya vienen los comunistas, me van a quitar mi casa; es un anticomunismo como si viviéramos en la guerra fría”, sentenció.Cabe recordar que la nueva Mesa Directiva del Congreso está conformada por la presidenta María del Carmen Alva, de Acción Popular; Lady Camones, de Alianza Para el Progreso; Patricia Chirinos, de Avanza País; y Enrique Wong, de Podemos Perú.Política, últimas noticiasEN VIVO: Pedro Castillo asumirá este miércoles 28 de julio la presidencia del PerúIzquierda en el Perú: la primera vez en el GobiernoPedro Castillo asume hoy el gobierno del bicentenarioNewsletter Política LRSuscríbete aquí al boletín Política La República y recibe a diario en tu correo electrónico las noticias más destacadas de los temas que marcan la agenda nacional.Recibe las noticias de La República en Google NewstemasCongreso del PerúRocío Silva SantistebanMesa Directiva del Congreso",larepublica,2021-07-28 14:43:35.057000+00:00
